{"$schema":"../../../schemas/comparison-scorecard-v2.schema.json","schema_version":"1.0.0","comparison_id":"abk:comparison:artifact-dag-core-v2","protocol_id":"abk:benchmark:pattern-adoption-v2","evaluated_at":"2026-08-06T23:50:11.9147498Z","status":"complete","source_snapshot":{"path":"benchmarks/campaigns/artifact-dag-core-v1/runs/full-campaign-20260805/campaign-run-index.json","sha256":"cbbff6d1cee4ec8598425a901c176bc1b281283c4dd542af34f015646d706a10","raw_runs":66},"baseline":{"branch":"control","eligibility":"baseline_only","raw_oracle_status":"UNSCORED","evidence_ids":["full-campaign-control-com-01-normal-primary-r1","full-campaign-control-com-01-normal-primary-r2","full-campaign-control-com-01-normal-primary-r3","full-campaign-control-com-02-normal-variant-r1","full-campaign-control-com-02-normal-variant-r2","full-campaign-control-com-02-normal-variant-r3","full-campaign-control-com-03-normal-repeat-r1","full-campaign-control-com-03-normal-repeat-r2","full-campaign-control-com-03-normal-repeat-r3","full-campaign-control-com-04-boundary-minimum-r1","full-campaign-control-com-05-invalid-input-r1","full-campaign-control-com-06-stop-interrupt-r1","full-campaign-control-com-06-stop-interrupt-r2","full-campaign-control-com-06-stop-interrupt-r3","full-campaign-control-spc-01-domain-boundary-r1","full-campaign-control-spc-02-failure-path-r1","full-campaign-control-spc-03-recovery-rollback-r1","full-campaign-control-spc-03-recovery-rollback-r2","full-campaign-control-spc-03-recovery-rollback-r3","full-campaign-control-spc-04-composition-handoff-r1","full-campaign-control-spc-04-composition-handoff-r2","full-campaign-control-spc-04-composition-handoff-r3"],"rationale":"The legacy control runner is retained as a pinned baseline reference and is excluded from v2 adoption eligibility."},"eligible_branches":["source_native","abk_native"],"hard_gates":[{"gate_id":"observable_state_and_errors","status":"pass","rationale":"The pinned raw evidence marks this gate as pass. The pinned raw evidence marks this gate as pass.","evidence_ids":["full-campaign-abk-native-com-01-normal-primary-r1","full-campaign-abk-native-com-01-normal-primary-r2","full-campaign-abk-native-com-01-normal-primary-r3","full-campaign-abk-native-com-02-normal-variant-r1","full-campaign-abk-native-com-02-normal-variant-r2","full-campaign-abk-native-com-02-normal-variant-r3","full-campaign-abk-native-com-03-normal-repeat-r1","full-campaign-abk-native-com-03-normal-repeat-r2","full-campaign-abk-native-com-03-normal-repeat-r3","full-campaign-abk-native-com-04-boundary-minimum-r1","full-campaign-abk-native-com-05-invalid-input-r1","full-campaign-abk-native-com-06-stop-interrupt-r1","full-campaign-abk-native-com-06-stop-interrupt-r2","full-campaign-abk-native-com-06-stop-interrupt-r3","full-campaign-abk-native-spc-01-domain-boundary-r1","full-campaign-abk-native-spc-02-failure-path-r1","full-campaign-abk-native-spc-03-recovery-rollback-r1","full-campaign-abk-native-spc-03-recovery-rollback-r2","full-campaign-abk-native-spc-03-recovery-rollback-r3","full-campaign-abk-native-spc-04-composition-handoff-r1","full-campaign-abk-native-spc-04-composition-handoff-r2","full-campaign-abk-native-spc-04-composition-handoff-r3","full-campaign-source-native-com-01-normal-primary-r1","full-campaign-source-native-com-01-normal-primary-r2","full-campaign-source-native-com-01-normal-primary-r3","full-campaign-source-native-com-02-normal-variant-r1","full-campaign-source-native-com-02-normal-variant-r2","full-campaign-source-native-com-02-normal-variant-r3","full-campaign-source-native-com-03-normal-repeat-r1","full-campaign-source-native-com-03-normal-repeat-r2","full-campaign-source-native-com-03-normal-repeat-r3","full-campaign-source-native-com-04-boundary-minimum-r1","full-campaign-source-native-com-05-invalid-input-r1","full-campaign-source-native-com-06-stop-interrupt-r1","full-campaign-source-native-com-06-stop-interrupt-r2","full-campaign-source-native-com-06-stop-interrupt-r3","full-campaign-source-native-spc-01-domain-boundary-r1","full-campaign-source-native-spc-02-failure-path-r1","full-campaign-source-native-spc-03-recovery-rollback-r1","full-campaign-source-native-spc-03-recovery-rollback-r2","full-campaign-source-native-spc-03-recovery-rollback-r3","full-campaign-source-native-spc-04-composition-handoff-r1","full-campaign-source-native-spc-04-composition-handoff-r2","full-campaign-source-native-spc-04-composition-handoff-r3"]},{"gate_id":"testable_behavior","status":"pass","rationale":"The pinned raw evidence marks this gate as pass. The pinned raw evidence marks this gate as pass.","evidence_ids":["full-campaign-abk-native-com-01-normal-primary-r1","full-campaign-abk-native-com-01-normal-primary-r2","full-campaign-abk-native-com-01-normal-primary-r3","full-campaign-abk-native-com-02-normal-variant-r1","full-campaign-abk-native-com-02-normal-variant-r2","full-campaign-abk-native-com-02-normal-variant-r3","full-campaign-abk-native-com-03-normal-repeat-r1","full-campaign-abk-native-com-03-normal-repeat-r2","full-campaign-abk-native-com-03-normal-repeat-r3","full-campaign-abk-native-com-04-boundary-minimum-r1","full-campaign-abk-native-com-05-invalid-input-r1","full-campaign-abk-native-com-06-stop-interrupt-r1","full-campaign-abk-native-com-06-stop-interrupt-r2","full-campaign-abk-native-com-06-stop-interrupt-r3","full-campaign-abk-native-spc-01-domain-boundary-r1","full-campaign-abk-native-spc-02-failure-path-r1","full-campaign-abk-native-spc-03-recovery-rollback-r1","full-campaign-abk-native-spc-03-recovery-rollback-r2","full-campaign-abk-native-spc-03-recovery-rollback-r3","full-campaign-abk-native-spc-04-composition-handoff-r1","full-campaign-abk-native-spc-04-composition-handoff-r2","full-campaign-abk-native-spc-04-composition-handoff-r3","full-campaign-source-native-com-01-normal-primary-r1","full-campaign-source-native-com-01-normal-primary-r2","full-campaign-source-native-com-01-normal-primary-r3","full-campaign-source-native-com-02-normal-variant-r1","full-campaign-source-native-com-02-normal-variant-r2","full-campaign-source-native-com-02-normal-variant-r3","full-campaign-source-native-com-03-normal-repeat-r1","full-campaign-source-native-com-03-normal-repeat-r2","full-campaign-source-native-com-03-normal-repeat-r3","full-campaign-source-native-com-04-boundary-minimum-r1","full-campaign-source-native-com-05-invalid-input-r1","full-campaign-source-native-com-06-stop-interrupt-r1","full-campaign-source-native-com-06-stop-interrupt-r2","full-campaign-source-native-com-06-stop-interrupt-r3","full-campaign-source-native-spc-01-domain-boundary-r1","full-campaign-source-native-spc-02-failure-path-r1","full-campaign-source-native-spc-03-recovery-rollback-r1","full-campaign-source-native-spc-03-recovery-rollback-r2","full-campaign-source-native-spc-03-recovery-rollback-r3","full-campaign-source-native-spc-04-composition-handoff-r1","full-campaign-source-native-spc-04-composition-handoff-r2","full-campaign-source-native-spc-04-composition-handoff-r3"]},{"gate_id":"declared_authority_and_side_effects","status":"pass","rationale":"The pinned raw evidence marks this gate as pass. The pinned raw evidence marks this gate as pass.","evidence_ids":["full-campaign-abk-native-com-01-normal-primary-r1","full-campaign-abk-native-com-01-normal-primary-r2","full-campaign-abk-native-com-01-normal-primary-r3","full-campaign-abk-native-com-02-normal-variant-r1","full-campaign-abk-native-com-02-normal-variant-r2","full-campaign-abk-native-com-02-normal-variant-r3","full-campaign-abk-native-com-03-normal-repeat-r1","full-campaign-abk-native-com-03-normal-repeat-r2","full-campaign-abk-native-com-03-normal-repeat-r3","full-campaign-abk-native-com-04-boundary-minimum-r1","full-campaign-abk-native-com-05-invalid-input-r1","full-campaign-abk-native-com-06-stop-interrupt-r1","full-campaign-abk-native-com-06-stop-interrupt-r2","full-campaign-abk-native-com-06-stop-interrupt-r3","full-campaign-abk-native-spc-01-domain-boundary-r1","full-campaign-abk-native-spc-02-failure-path-r1","full-campaign-abk-native-spc-03-recovery-rollback-r1","full-campaign-abk-native-spc-03-recovery-rollback-r2","full-campaign-abk-native-spc-03-recovery-rollback-r3","full-campaign-abk-native-spc-04-composition-handoff-r1","full-campaign-abk-native-spc-04-composition-handoff-r2","full-campaign-abk-native-spc-04-composition-handoff-r3","full-campaign-source-native-com-01-normal-primary-r1","full-campaign-source-native-com-01-normal-primary-r2","full-campaign-source-native-com-01-normal-primary-r3","full-campaign-source-native-com-02-normal-variant-r1","full-campaign-source-native-com-02-normal-variant-r2","full-campaign-source-native-com-02-normal-variant-r3","full-campaign-source-native-com-03-normal-repeat-r1","full-campaign-source-native-com-03-normal-repeat-r2","full-campaign-source-native-com-03-normal-repeat-r3","full-campaign-source-native-com-04-boundary-minimum-r1","full-campaign-source-native-com-05-invalid-input-r1","full-campaign-source-native-com-06-stop-interrupt-r1","full-campaign-source-native-com-06-stop-interrupt-r2","full-campaign-source-native-com-06-stop-interrupt-r3","full-campaign-source-native-spc-01-domain-boundary-r1","full-campaign-source-native-spc-02-failure-path-r1","full-campaign-source-native-spc-03-recovery-rollback-r1","full-campaign-source-native-spc-03-recovery-rollback-r2","full-campaign-source-native-spc-03-recovery-rollback-r3","full-campaign-source-native-spc-04-composition-handoff-r1","full-campaign-source-native-spc-04-composition-handoff-r2","full-campaign-source-native-spc-04-composition-handoff-r3"]},{"gate_id":"reversible_or_recoverable","status":"pass","rationale":"V2 adjudication accepts the recovery and rollback evidence as sufficient for the eligible source-native comparison. V2 adjudication accepts the recovery and rollback evidence as sufficient for the eligible ABK-native comparison.","evidence_ids":["full-campaign-abk-native-com-01-normal-primary-r1","full-camp